{
  "protocol": "lodestone/1",
  "error": "moved",
  "moved": {
    "from": "https://alex.old-provider.example",
    "to": "https://alex.new-provider.example",
    "at": "2026-11-02T10:00:00+00:00"
  },
  "signature": "eyJhbGciOiJFZERTQSIsImtpZCI6ImsxIn0..c2lnbmF0dXJl",
  "message": "This memory has moved to https://alex.new-provider.example. Connect there instead."
}
